{
  "schema_version": "1.0",
  "tool": "streamcli (conforming streams)",
  "command": ["./streamcli"],
  "timeout_seconds": 3,
  "probes": [
    { "name": "stream to the summary line", "argv": ["good"], "kind": "stream" },
    { "name": "interrupt the stream", "argv": ["good"], "kind": "stream", "signal": "INT", "after_lines": 2 },
    { "name": "stream with a heartbeat", "argv": ["heartbeat"], "kind": "stream" },
    { "name": "stream that fails midway", "argv": ["fails-midway"], "kind": "stream", "deadline_seconds": 2 },
    { "name": "numbered stream", "argv": ["seq-good"], "kind": "stream" },
    { "name": "numbered stream that fails midway", "argv": ["seq-fails"], "kind": "stream" }
  ]
}
